{
  "version": 1,
  "title": "Skills vs. Agentes de IA: a diferença na prática",
  "channel": "framechester",
  "format": "vertical",
  "language": "pt-BR",
  "scenes": [
    {
      "id": 0,
      "concept": "Agente ou skill?",
      "learning_goal": "Abrir o loop: o espectador precisa querer a resposta.",
      "narration": "Agente de IA e skill não são a mesma coisa. Qual é a diferença na prática?",
      "segments": [
        {
          "text": "Agente de IA e skill não são a mesma coisa.",
          "start_secs": 0.0,
          "end_secs": 2.932,
          "words": [
            {
              "text": "Agente",
              "start_secs": 0.03,
              "end_secs": 0.46301407
            },
            {
              "text": "de",
              "start_secs": 0.46301407,
              "end_secs": 0.6073521
            },
            {
              "text": "IA",
              "start_secs": 0.6073521,
              "end_secs": 0.7516901
            },
            {
              "text": "e",
              "start_secs": 0.7516901,
              "end_secs": 0.8238591
            },
            {
              "text": "skill",
              "start_secs": 0.8238591,
              "end_secs": 1.1847042
            },
            {
              "text": "não",
              "start_secs": 1.1847042,
              "end_secs": 1.4012113
            },
            {
              "text": "são",
              "start_secs": 1.4012113,
              "end_secs": 1.6177183
            },
            {
              "text": "a",
              "start_secs": 1.6177183,
              "end_secs": 1.6898874
            },
            {
              "text": "mesma",
              "start_secs": 1.6898874,
              "end_secs": 2.0507326
            },
            {
              "text": "coisa.",
              "start_secs": 2.0507326,
              "end_secs": 2.592
            }
          ],
          "aligned": false
        },
        {
          "text": "Qual é a diferença na prática?",
          "start_secs": 3.212,
          "end_secs": 5.47,
          "words": [
            {
              "text": "Qual",
              "start_secs": 3.2819998,
              "end_secs": 3.5684905
            },
            {
              "text": "é",
              "start_secs": 3.5684905,
              "end_secs": 3.640113
            },
            {
              "text": "a",
              "start_secs": 3.640113,
              "end_secs": 3.7117357
            },
            {
              "text": "diferença",
              "start_secs": 3.7117357,
              "end_secs": 4.3563395
            },
            {
              "text": "na",
              "start_secs": 4.3563395,
              "end_secs": 4.4995847
            },
            {
              "text": "prática?",
              "start_secs": 4.4995847,
              "end_secs": 5.18
            }
          ],
          "aligned": false
        }
      ],
      "duration_secs": 5.9199996,
      "start_secs": 0.0,
      "composition": {
        "kind": "title",
        "text": "Agente ou skill: qual é a diferença na prática?",
        "kicker": "Pergunta"
      },
      "animations": [
        {
          "target": "title",
          "motion": "reveal",
          "at": "start",
          "duration_secs": 0.55,
          "easing": "ease_out"
        },
        {
          "target": "*",
          "motion": "breathe",
          "at": "start",
          "duration_secs": 4.0,
          "easing": "ease_in_out"
        }
      ],
      "captions": {
        "emphasis": [],
        "hidden": false
      },
      "resources": [],
      "validation": {
        "spoken_terms": [],
        "min_visual_changes": 2,
        "max_still_secs": 5.0,
        "readable_without_audio": true
      },
      "transition": "cut"
    },
    {
      "id": 1,
      "concept": "O agente decide em um loop",
      "learning_goal": "Mostrar que a decisão é do agente: cada etapa acende quando é dita.",
      "narration": "Um agente é um loop. Ele recebe um objetivo, decide o próximo passo, age com uma ferramenta e observa o resultado. Depois repete, até concluir a tarefa.",
      "segments": [
        {
          "text": "Um agente é um loop.",
          "start_secs": 0.0,
          "end_secs": 1.5753334,
          "words": [
            {
              "text": "Um",
              "start_secs": 0.04,
              "end_secs": 0.16289523
            },
            {
              "text": "agente",
              "start_secs": 0.16289523,
              "end_secs": 0.5315809
            },
            {
              "text": "é",
              "start_secs": 0.5315809,
              "end_secs": 0.59302855
            },
            {
              "text": "um",
              "start_secs": 0.59302855,
              "end_secs": 0.7159238
            },
            {
              "text": "loop.",
              "start_secs": 0.7159238,
              "end_secs": 1.1153333
            }
          ],
          "aligned": false
        },
        {
          "text": "Ele recebe um objetivo, decide o próximo passo, age com uma ferramenta e observa o resultado.",
          "start_secs": 1.8553333,
          "end_secs": 7.9353333,
          "words": [
            {
              "text": "Ele",
              "start_secs": 1.8853333,
              "end_secs": 2.0980337
            },
            {
              "text": "recebe",
              "start_secs": 2.0980337,
              "end_secs": 2.5234344
            },
            {
              "text": "um",
              "start_secs": 2.5234344,
              "end_secs": 2.6652346
            },
            {
              "text": "objetivo,",
              "start_secs": 2.6652346,
              "end_secs": 3.360056
            },
            {
              "text": "decide",
              "start_secs": 3.360056,
              "end_secs": 3.7854567
            },
            {
              "text": "o",
              "start_secs": 3.7854567,
              "end_secs": 3.8563569
            },
            {
              "text": "próximo",
              "start_secs": 3.8563569,
              "end_secs": 4.352658
            },
            {
              "text": "passo,",
              "start_secs": 4.352658,
              "end_secs": 4.834779
            },
            {
              "text": "age",
              "start_secs": 4.834779,
              "end_secs": 5.047479
            },
            {
              "text": "com",
              "start_secs": 5.047479,
              "end_secs": 5.2601795
            },
            {
              "text": "uma",
              "start_secs": 5.2601795,
              "end_secs": 5.47288
            },
            {
              "text": "ferramenta",
              "start_secs": 5.47288,
              "end_secs": 6.181881
            },
            {
              "text": "e",
              "start_secs": 6.181881,
              "end_secs": 6.252781
            },
            {
              "text": "observa",
              "start_secs": 6.252781,
              "end_secs": 6.7490816
            },
            {
              "text": "o",
              "start_secs": 6.7490816,
              "end_secs": 6.8199816
            },
            {
              "text": "resultado.",
              "start_secs": 6.8199816,
              "end_secs": 7.635333
            }
          ],
          "aligned": false
        },
        {
          "text": "Depois repete, até concluir a tarefa.",
          "start_secs": 8.215333,
          "end_secs": 10.969999,
          "words": [
            {
              "text": "Depois",
              "start_secs": 8.245333,
              "end_secs": 8.669473
            },
            {
              "text": "repete,",
              "start_secs": 8.669473,
              "end_secs": 9.220855
            },
            {
              "text": "até",
              "start_secs": 9.220855,
              "end_secs": 9.432924
            },
            {
              "text": "concluir",
              "start_secs": 9.432924,
              "end_secs": 9.998445
            },
            {
              "text": "a",
              "start_secs": 9.998445,
              "end_secs": 10.069135
            },
            {
              "text": "tarefa.",
              "start_secs": 10.069135,
              "end_secs": 10.669999
            }
          ],
          "aligned": false
        }
      ],
      "duration_secs": 11.419999,
      "start_secs": 5.9199996,
      "composition": {
        "kind": "flow_diagram",
        "objects": [
          {
            "id": "objetivo",
            "label": "Objetivo",
            "role": "neutral",
            "icon": "user"
          },
          {
            "id": "decidir",
            "label": "Decidir",
            "role": "primary",
            "icon": "brain"
          },
          {
            "id": "agir",
            "label": "Agir",
            "role": "neutral",
            "icon": "tool"
          },
          {
            "id": "observar",
            "label": "Observar",
            "role": "neutral",
            "icon": "search"
          }
        ],
        "relations": [
          {
            "from": "objetivo",
            "to": "decidir",
            "kind": "flow"
          },
          {
            "from": "decidir",
            "to": "agir",
            "kind": "flow"
          },
          {
            "from": "agir",
            "to": "observar",
            "kind": "flow"
          }
        ],
        "looped": true
      },
      "animations": [
        {
          "target": "objetivo",
          "motion": "pop",
          "at": "start",
          "duration_secs": 0.55,
          "easing": "back"
        },
        {
          "target": "decidir",
          "motion": "pop",
          "at": {
            "word": {
              "word": "decide",
              "occurrence": 0
            }
          },